{
 "format": "jj-anim/1",
 "name": "pair_shoulder",
 "title": "Hand auf Schulter",
 "type": "pair",
 "fps": 30,
 "duration": 2,
 "loop": false,
 "actors": {
  "a": {
   "model": "mp_m_freemode_01",
   "label": "Akteur A"
  },
  "b": {
   "model": "mp_f_freemode_01",
   "label": "Akteur B"
  }
 },
 "tracks": {
  "a": {
   "mover": [
    {
     "t": 0,
     "p": [
      0,
      0,
      0
     ],
     "yaw": 0
    }
   ],
   "ik": {
    "handR": [
     {
      "t": 0,
      "target": [
       0.3,
       0.05,
       -0.28
      ],
      "pole": [
       0.6,
       -0.5,
       -0.6
      ]
     },
     {
      "t": 0.7,
      "target": [
       0.18,
       0.4,
       0.3
      ],
      "pole": [
       0.8,
       -0.4,
       -0.4
      ],
      "ease": "fastIn"
     }
    ]
   },
   "bones": {
    "SKEL_L_UpperArm": [
     {
      "t": 0,
      "rot": [
       4,
       36,
       0
      ]
     }
    ],
    "SKEL_L_Forearm": [
     {
      "t": 0,
      "rot": [
       12,
       0,
       0
      ]
     }
    ],
    "SKEL_Spine2": [
     {
      "t": 0,
      "rot": [
       0,
       0,
       0
      ]
     },
     {
      "t": 0.8,
      "rot": [
       -8,
       0,
       4
      ]
     }
    ]
   },
   "fingers": {
    "R": [
     {
      "t": 0,
      "preset": "relaxed"
     },
     {
      "t": 0.7,
      "preset": "grab",
      "curl": 0.6
     }
    ]
   },
   "look": [
    {
     "t": 0,
     "target": [
      0,
      0.6,
      0.55
     ],
     "space": "body",
     "weight": 0.8
    }
   ]
  },
  "b": {
   "mover": [
    {
     "t": 0,
     "p": [
      0,
      0.42,
      0
     ],
     "yaw": 180
    }
   ],
   "bones": {
    "SKEL_L_UpperArm": [
     {
      "t": 0,
      "rot": [
       4,
       36,
       0
      ]
     }
    ],
    "SKEL_L_Forearm": [
     {
      "t": 0,
      "rot": [
       12,
       0,
       0
      ]
     }
    ],
    "SKEL_R_UpperArm": [
     {
      "t": 0,
      "rot": [
       4,
       36,
       0
      ]
     }
    ],
    "SKEL_R_Forearm": [
     {
      "t": 0,
      "rot": [
       12,
       0,
       0
      ]
     }
    ],
    "SKEL_Head": [
     {
      "t": 0,
      "rot": [
       0,
       0,
       0
      ]
     },
     {
      "t": 0.9,
      "rot": [
       0,
       0,
       0
      ]
     },
     {
      "t": 1.4,
      "rot": [
       -5,
       0,
       -30
      ]
     }
    ],
    "SKEL_Spine1": [
     {
      "t": 0.9,
      "rot": [
       0,
       0,
       0
      ]
     },
     {
      "t": 1.4,
      "rot": [
       0,
       0,
       -6
      ]
     }
    ]
   }
  }
 },
 "contacts": [
  {
   "id": "hand_shoulder",
   "from": "a.handR",
   "to": "b.SKEL_L_UpperArm",
   "offset": [
    0,
    0,
    0.07
   ],
   "t": [
    0.75,
    2
   ],
   "stick": true,
   "max": 0.03
  }
 ],
 "events": [
  {
   "name": "touch",
   "t": 0.75
  }
 ],
 "notes": "Beispiel: A legt B die Hand auf die Schulter, B dreht den Kopf."
}
