{
 "format": "jj-anim/1",
 "name": "walk_cycle",
 "title": "Gehen (Loop)",
 "type": "single",
 "fps": 30,
 "duration": 1,
 "loop": true,
 "loopMover": "travel",
 "actors": {
  "a": {
   "model": "mp_m_freemode_01",
   "label": "Geher"
  }
 },
 "tracks": {
  "a": {
   "mover": [
    {
     "t": 0,
     "p": [
      0,
      0,
      0
     ],
     "yaw": 0,
     "ease": "linear"
    },
    {
     "t": 1,
     "p": [
      0,
      1.3,
      0
     ],
     "yaw": 0,
     "ease": "linear"
    }
   ],
   "root": [
    {
     "t": 0,
     "p": [
      0,
      0,
      -0.045
     ]
    },
    {
     "t": 0.25,
     "p": [
      0,
      0,
      -0.028
     ]
    },
    {
     "t": 0.5,
     "p": [
      0,
      0,
      -0.045
     ]
    },
    {
     "t": 0.75,
     "p": [
      0,
      0,
      -0.028
     ]
    }
   ],
   "ik": {
    "footL": [
     {
      "t": 0,
      "target": [
       -0.1,
       0.39,
       -0.908
      ],
      "space": "body",
      "ease": "linear"
     },
     {
      "t": 0.6,
      "target": [
       -0.1,
       -0.39,
       -0.908
      ],
      "space": "body",
      "ease": "linear"
     },
     {
      "t": 0.65,
      "target": [
       -0.1,
       -0.44,
       -0.863
      ],
      "space": "body",
      "ease": "linear"
     },
     {
      "t": 0.8,
      "target": [
       -0.1,
       0.1,
       -0.808
      ],
      "space": "body",
      "ease": "smooth"
     },
     {
      "t": 0.93,
      "target": [
       -0.1,
       0.47,
       -0.878
      ],
      "space": "body",
      "ease": "smooth"
     }
    ],
    "footR": [
     {
      "t": 0,
      "target": [
       0.1,
       -0.26,
       -0.908
      ],
      "space": "body",
      "ease": "linear"
     },
     {
      "t": 0.1,
      "target": [
       0.1,
       -0.39,
       -0.908
      ],
      "space": "body",
      "ease": "linear"
     },
     {
      "t": 0.15,
      "target": [
       0.1,
       -0.44,
       -0.863
      ],
      "space": "body",
      "ease": "linear"
     },
     {
      "t": 0.3,
      "target": [
       0.1,
       0.1,
       -0.808
      ],
      "space": "body",
      "ease": "smooth"
     },
     {
      "t": 0.43,
      "target": [
       0.1,
       0.47,
       -0.878
      ],
      "space": "body",
      "ease": "smooth"
     },
     {
      "t": 0.5,
      "target": [
       0.1,
       0.39,
       -0.908
      ],
      "space": "body",
      "ease": "linear"
     }
    ]
   },
   "bones": {
    "SKEL_L_UpperArm": [
     {
      "t": 0,
      "rot": [
       -14,
       0,
       0
      ]
     },
     {
      "t": 0.5,
      "rot": [
       14,
       0,
       0
      ]
     }
    ],
    "SKEL_R_UpperArm": [
     {
      "t": 0,
      "rot": [
       14,
       0,
       0
      ]
     },
     {
      "t": 0.5,
      "rot": [
       -14,
       0,
       0
      ]
     }
    ],
    "SKEL_L_Forearm": [
     {
      "t": 0,
      "rot": [
       12,
       0,
       0
      ]
     },
     {
      "t": 0.5,
      "rot": [
       22,
       0,
       0
      ]
     }
    ],
    "SKEL_R_Forearm": [
     {
      "t": 0,
      "rot": [
       22,
       0,
       0
      ]
     },
     {
      "t": 0.5,
      "rot": [
       12,
       0,
       0
      ]
     }
    ],
    "SKEL_Spine2": [
     {
      "t": 0,
      "rot": [
       4,
       0,
       -4
      ]
     },
     {
      "t": 0.5,
      "rot": [
       4,
       0,
       4
      ]
     }
    ]
   },
   "fingers": {
    "L": [
     {
      "t": 0,
      "preset": "relaxed"
     }
    ],
    "R": [
     {
      "t": 0,
      "preset": "relaxed"
     }
    ]
   }
  }
 },
 "contacts": [],
 "events": [
  {
   "name": "step_l",
   "t": 0
  },
  {
   "name": "step_r",
   "t": 0.5
  }
 ],
 "notes": "Beispiel: Gang-Zyklus, 1,3 m/s, Loop mit Bewegung nach vorn."
}
