{
 "format": "jj-anim/1",
 "name": "single_wave",
 "title": "Winken",
 "type": "single",
 "fps": 30,
 "duration": 2.4,
 "loop": true,
 "actors": {
  "a": {
   "model": "mp_m_freemode_01",
   "label": "Spieler"
  }
 },
 "tracks": {
  "a": {
   "mover": [
    {
     "t": 0,
     "p": [
      0,
      0,
      0
     ],
     "yaw": 0
    }
   ],
   "bones": {
    "SKEL_R_UpperArm": [
     {
      "t": 0,
      "rot": [
       0,
       0,
       0
      ]
     },
     {
      "t": 0.5,
      "rot": [
       20,
       -100,
       10
      ]
     },
     {
      "t": 1.9,
      "rot": [
       20,
       -100,
       10
      ]
     }
    ],
    "SKEL_R_Forearm": [
     {
      "t": 0,
      "rot": [
       10,
       0,
       0
      ]
     },
     {
      "t": 0.5,
      "rot": [
       70,
       0,
       0
      ]
     },
     {
      "t": 0.8,
      "rot": [
       40,
       0,
       0
      ]
     },
     {
      "t": 1.1,
      "rot": [
       70,
       0,
       0
      ]
     },
     {
      "t": 1.4,
      "rot": [
       40,
       0,
       0
      ]
     },
     {
      "t": 1.7,
      "rot": [
       70,
       0,
       0
      ]
     },
     {
      "t": 1.9,
      "rot": [
       70,
       0,
       0
      ]
     }
    ],
    "SKEL_Head": [
     {
      "t": 0,
      "rot": [
       0,
       0,
       0
      ]
     },
     {
      "t": 0.6,
      "rot": [
       -8,
       0,
       -25
      ]
     },
     {
      "t": 1.9,
      "rot": [
       -8,
       0,
       -25
      ]
     }
    ],
    "SKEL_Spine2": [
     {
      "t": 0,
      "rot": [
       0,
       0,
       0
      ]
     },
     {
      "t": 0.6,
      "rot": [
       0,
       -4,
       -6
      ]
     },
     {
      "t": 1.9,
      "rot": [
       0,
       -4,
       -6
      ]
     }
    ]
   },
   "ik": {
    "handL": [
     {
      "t": 0,
      "target": [
       -0.36,
       0.02,
       -0.33
      ],
      "space": "body"
     }
    ]
   },
   "fingers": {
    "R": [
     {
      "t": 0,
      "preset": "relaxed"
     },
     {
      "t": 0.5,
      "preset": "open"
     },
     {
      "t": 1.9,
      "preset": "open"
     }
    ],
    "L": [
     {
      "t": 0,
      "preset": "relaxed"
     }
    ]
   },
   "look": [
    {
     "t": 0,
     "target": [
      0,
      2,
      0.6
     ],
     "space": "body",
     "weight": 0.5
    }
   ]
  }
 },
 "contacts": [],
 "events": [
  {
   "name": "wave_peak",
   "t": 0.8
  }
 ],
 "notes": "Beispiel: Winken mit rechtem Arm (Loop)."
}
